{"$schema":"https://json-schema.org/draft/2020-12/schema","type":"object","required":["adjudication_status","adjudication_id","case_id","binding_id","metadata_field","input_review_ids","input_reviewer_ids","input_reviews","adjudicator_id","final_decision","timestamp_utc","evidence_snapshot_sha256","input_golden_set_version","catalog_contract_version","catalog_contract_sha256","resulting_gold_version"],"properties":{"adjudication_status":{"enum":["TEMPLATE","FINAL"]},"adjudication_id":{"type":"string","minLength":1},"case_id":{"type":"string","minLength":1},"binding_id":{"type":"string","minLength":1},"metadata_field":{"type":"string","minLength":1},"input_review_ids":{"type":"array","minItems":2,"maxItems":2,"uniqueItems":true,"items":{"type":"string","minLength":1}},"input_reviewer_ids":{"type":"array","minItems":2,"maxItems":2,"uniqueItems":true,"items":{"type":"string","minLength":1}},"input_reviews":{"type":"array","minItems":2,"maxItems":2,"uniqueItems":true,"items":{"type":"object","required":["review_id","reviewer_id","case_id","binding_id","evidence_snapshot_sha256"],"properties":{"review_id":{"type":"string","minLength":1},"reviewer_id":{"type":"string","minLength":1},"case_id":{"type":"string","minLength":1},"binding_id":{"type":"string","minLength":1},"evidence_snapshot_sha256":{"type":"string","pattern":"^[A-Fa-f0-9]{64}$|^REPLACE_[A-Z0-9_]+$"}},"additionalProperties":false}},"adjudicator_id":{"type":"string","minLength":1},"final_decision":{"enum":["ACCEPT_AS_IS","ACCEPT_WITH_MINOR_EDIT","RESEARCH_REQUIRED","REJECT"]},"final_value":{"type":["string","null"]},"final_abstention":{"type":"boolean"},"error_codes":{"type":"array","uniqueItems":true,"items":{"enum":["UNSUPPORTED_VALUE","WRONG_BINDING","WRONG_INTENT","GROUNDING_ERROR","CARDINALITY_ERROR","NORMALIZATION_ERROR","CONTROLLED_VOCABULARY_ERROR","MISSED_EXPECTED_CANDIDATE","FALSE_PROPOSAL_WHEN_ABSTENTION_EXPECTED"]}},"comment":{"type":"string"},"timestamp_utc":{"type":"string","format":"date-time"},"evidence_snapshot_sha256":{"type":"string","pattern":"^[A-Fa-f0-9]{64}$|^REPLACE_[A-Z0-9_]+$"},"input_golden_set_version":{"type":"string","minLength":1},"catalog_contract_version":{"type":"string","minLength":1},"catalog_contract_sha256":{"type":"string","pattern":"^[A-Fa-f0-9]{64}$|^REPLACE_[A-Z0-9_]+$"},"resulting_gold_version":{"type":"string","minLength":1},"supersedes_adjudication_id":{"type":["string","null"]}},"allOf":[{"if":{"properties":{"adjudication_status":{"const":"FINAL"}},"required":["adjudication_status"]},"then":{"properties":{"evidence_snapshot_sha256":{"pattern":"^[A-Fa-f0-9]{64}$"},"catalog_contract_sha256":{"pattern":"^[A-Fa-f0-9]{64}$"},"input_reviews":{"items":{"properties":{"evidence_snapshot_sha256":{"pattern":"^[A-Fa-f0-9]{64}$"}}}}}}}],"additionalProperties":false}
