{"adjudication_status":"TEMPLATE","adjudication_id":"REPLACE_ADJUDICATION_ID","case_id":"REPLACE_CASE_ID","binding_id":"REPLACE_BINDING_ID","metadata_field":"REPLACE_METADATA_FIELD","input_review_ids":["REPLACE_REVIEW_ID_1","REPLACE_REVIEW_ID_2"],"input_reviewer_ids":["REPLACE_REVIEWER_ID_1","REPLACE_REVIEWER_ID_2"],"input_reviews":[{"review_id":"REPLACE_REVIEW_ID_1","reviewer_id":"REPLACE_REVIEWER_ID_1","case_id":"REPLACE_CASE_ID","binding_id":"REPLACE_BINDING_ID","evidence_snapshot_sha256":"REPLACE_EVIDENCE_SHA256"},{"review_id":"REPLACE_REVIEW_ID_2","reviewer_id":"REPLACE_REVIEWER_ID_2","case_id":"REPLACE_CASE_ID","binding_id":"REPLACE_BINDING_ID","evidence_snapshot_sha256":"REPLACE_EVIDENCE_SHA256"}],"adjudicator_id":"REPLACE_ADJUDICATOR_ID","final_decision":"RESEARCH_REQUIRED","final_value":null,"final_abstention":false,"error_codes":[],"comment":"Template only; replace after documented disagreement resolution.","timestamp_utc":"2026-01-01T00:00:00Z","evidence_snapshot_sha256":"REPLACE_EVIDENCE_SHA256","input_golden_set_version":"REPLACE_GOLDEN_SET_VERSION","catalog_contract_version":"REPLACE_CATALOG_CONTRACT_VERSION","catalog_contract_sha256":"REPLACE_CATALOG_CONTRACT_SHA256","resulting_gold_version":"REPLACE_RESULTING_GOLD_VERSION","supersedes_adjudication_id":null}
